{
  "schemaVersion": "1.3.0",
  "generatedAt": "2026-02-16T21:49:10.733Z",
  "generatedFrom": {
    "commitSha": "1e7def95ecc984d344471260521d93a623f19ae9",
    "commitShaSource": "git",
    "commitTime": "2026-02-16T21:47:10Z",
    "commitTimeSource": "git",
    "dirty": true,
    "exportStatuses": [
      "published"
    ]
  },
  "policies": {
    "conflictPolicy": {
      "precedence": [
        "EU_PRIMARY_LAW",
        "EU_SUPERVISORY_GUIDANCE",
        "FRAMEWORK_CANONICAL_ENTRY"
      ],
      "ifUnclear": "defer_to_human"
    }
  },
  "entries": [
    {
      "slug": "analysis-models/correspondent-relationships-nested-vasp-risk-eu",
      "type": "model",
      "status": "published",
      "entryIntent": "interpretation",
      "canonicalStatement": "Nested service exposure MUST be assessed as indirect counterparty risk with explicit mapping of service chains and control responsibilities.",
      "definition": "This model maps multi-entity crypto service chains, identifies control ownership (CDD, Travel Rule, sanctions, monitoring), and evaluates indirect exposure over time.",
      "scope": "Regulated banking environments in EU/UK",
      "confidence": "high",
      "risk": "medium",
      "jurisdictions": [
        "EU",
        "GLOBAL"
      ],
      "regimes": [
        "AMLR",
        "EBA_GUIDANCE",
        "FATF"
      ],
      "referencePolicy": "EU_AND_GLOBAL",
      "citationVerified": true,
      "agentUsage": {
        "allowed": [
          "policy_explanation",
          "report_drafting",
          "terminology_alignment"
        ],
        "forbidden": [
          "compliance_decision",
          "customer_risk_scoring",
          "regulatory_conclusion"
        ]
      },
      "embeddingHint": "This model maps multi-entity crypto service chains, identifies control ownership (CDD, Travel Rule, sanctions, monitoring), and evaluates indirect exposure over time.",
      "lastReviewed": "2026-02-14",
      "canonicalUrl": "/framework/analysis-models/correspondent-relationships-nested-vasp-risk-eu",
      "relatedSlugs": [
        "methodology/counterparty-risk-assessment-crypto-eu",
        "methodology/sanctions-exposure-screening-crypto-eu",
        "regulatory-context/travel-rule-applicability-counterparty-information-eu"
      ],
      "sources": [
        {
          "title": "AMLR — Regulation (EU) 2024/1624",
          "url": "https://eur-lex.europa.eu/eli/reg/2024/1624/oj/eng"
        },
        {
          "title": "EBA Guidelines on ML/TF Risk Factors",
          "url": "https://www.eba.europa.eu/regulation-and-policy/anti-money-laundering-and-countering-financing-terrorism/guidelines-mltf-risk-factors"
        },
        {
          "title": "FATF Recommendations",
          "url": "https://www.fatf-gafi.org/en/publications/Fatfrecommendations/Fatf-recommendations.html"
        }
      ],
      "sourceAuthorityCount": 3,
      "sourceDomains": [
        "eur-lex.europa.eu",
        "www.eba.europa.eu",
        "www.fatf-gafi.org"
      ],
      "prohibitedInferences": [
        "A regulated counterparty implies all downstream parties are regulated and low risk.",
        "Indirect exposure is irrelevant if a direct counterparty is known.",
        "Lack of chain transparency automatically implies wrongdoing.",
        "Service chain complexity alone proves illicit activity."
      ],
      "interpretationBoundary": {
        "doesNotProvideLegalAdvice": true,
        "requiresHumanValidation": true,
        "prohibitedInferences": [
          "A regulated counterparty implies all downstream parties are regulated and low risk.",
          "Indirect exposure is irrelevant if a direct counterparty is known.",
          "Lack of chain transparency automatically implies wrongdoing.",
          "Service chain complexity alone proves illicit activity."
        ]
      },
      "authorityTier": "T0_PRIMARY_LAW",
      "authorityTierDetail": {
        "level": 1,
        "meaning": "Derived directly from EU primary law sources (EUR-Lex/ec.europa.eu/commission.europa.eu).",
        "allowedAgentUsage": [
          "terminology_alignment",
          "policy_explanation",
          "report_drafting"
        ],
        "forbiddenAgentUsage": [
          "compliance_decision",
          "customer_risk_scoring",
          "regulatory_conclusion"
        ]
      },
      "authorityBasis": {
        "tierDrivers": [
          "eur-lex.europa.eu",
          "www.eba.europa.eu",
          "www.fatf-gafi.org"
        ],
        "referenceCountByTier": {
          "T0_PRIMARY_LAW": 1,
          "T1_SUPERVISORY_GUIDANCE": 2,
          "T2_INDUSTRY_STANDARD": 0,
          "T3_OPERATIONAL_INTERPRETATION": 0
        }
      },
      "whyItMattersSummary": "Direct counterparties can mask downstream entities where actual risk and control gaps sit.",
      "failureModeSummary": "Institutions assume end-to-end control coverage, while nested provider changes and unknown sub-chains create unmanaged exposure.",
      "scopeNonClaimsSummary": "This entry is scoped to complex service-chain assessment in regulated banking environments in the EU/UK.",
      "source": {
        "contentPath": "content/analysis-models/correspondent-relationships-nested-vasp-risk-eu.mdx"
      },
      "contentHash": "sha256:d49fe200a7c14d84d685958c7557047bf00037832a502940d08ba3d91b9730e2"
    },
    {
      "slug": "analysis-models/defi-positions-yield-income-assessment-eu",
      "type": "model",
      "status": "published",
      "entryIntent": "interpretation",
      "canonicalStatement": "DeFi-related positions and yield MUST be assessed as part of portfolio-level exposure and income patterns, using verifiable evidence and explainable aggregation over time.",
      "definition": "Within this framework, DeFi assessment is a time-based interpretation of protocol events, position states, and valuation assumptions that distinguishes principal, yield, and realized outcomes where evidence supports it.",
      "scope": "Regulated banking environments in EU/UK",
      "confidence": "high",
      "risk": "medium",
      "jurisdictions": [
        "EU",
        "GLOBAL"
      ],
      "regimes": [
        "AMLR",
        "FATF"
      ],
      "referencePolicy": "EU_AND_GLOBAL",
      "citationVerified": true,
      "agentUsage": {
        "allowed": [
          "policy_explanation",
          "report_drafting",
          "terminology_alignment"
        ],
        "forbidden": [
          "compliance_decision",
          "customer_risk_scoring",
          "regulatory_conclusion"
        ]
      },
      "embeddingHint": "Within this framework, DeFi assessment is a time-based interpretation of protocol events, position states, and valuation assumptions that distinguishes principal, yield, and realized outcomes where evidence supports it.",
      "lastReviewed": "2026-02-14",
      "canonicalUrl": "/framework/analysis-models/defi-positions-yield-income-assessment-eu",
      "relatedSlugs": [
        "analysis-models/wallets-portfolio-level-assessment-eu",
        "definitions/source-of-funds-vs-source-of-wealth-crypto-eu",
        "methodology/evidence-correlation-onchain-offchain-eu"
      ],
      "sources": [
        {
          "title": "AMLR — Regulation (EU) 2024/1624",
          "url": "https://eur-lex.europa.eu/eli/reg/2024/1624/oj"
        },
        {
          "title": "FATF Recommendations — Recommendation 1 and Interpretive Note",
          "url": "https://www.fatf-gafi.org/en/publications/Fatfrecommendations/Fatf-recommendations.html"
        }
      ],
      "sourceAuthorityCount": 2,
      "sourceDomains": [
        "eur-lex.europa.eu",
        "www.fatf-gafi.org"
      ],
      "prohibitedInferences": [
        "A single snapshot of positions is sufficient for SoW conclusions.",
        "DeFi participation implies illicit activity.",
        "Portfolio complexity alone implies money laundering.",
        "Yield estimates without documented assumptions constitute verified income."
      ],
      "interpretationBoundary": {
        "doesNotProvideLegalAdvice": true,
        "requiresHumanValidation": true,
        "prohibitedInferences": [
          "A single snapshot of positions is sufficient for SoW conclusions.",
          "DeFi participation implies illicit activity.",
          "Portfolio complexity alone implies money laundering.",
          "Yield estimates without documented assumptions constitute verified income."
        ]
      },
      "authorityTier": "T0_PRIMARY_LAW",
      "authorityTierDetail": {
        "level": 1,
        "meaning": "Derived directly from EU primary law sources (EUR-Lex/ec.europa.eu/commission.europa.eu).",
        "allowedAgentUsage": [
          "terminology_alignment",
          "policy_explanation",
          "report_drafting"
        ],
        "forbiddenAgentUsage": [
          "compliance_decision",
          "customer_risk_scoring",
          "regulatory_conclusion"
        ]
      },
      "authorityBasis": {
        "tierDrivers": [
          "eur-lex.europa.eu",
          "www.fatf-gafi.org"
        ],
        "referenceCountByTier": {
          "T0_PRIMARY_LAW": 1,
          "T1_SUPERVISORY_GUIDANCE": 1,
          "T2_INDUSTRY_STANDARD": 0,
          "T3_OPERATIONAL_INTERPRETATION": 0
        }
      },
      "whyItMattersSummary": "Snapshot-only views miss income dynamics and can misstate wealth narratives. Time-windowed evidence and explicit assumptions are required for defensible outcomes.",
      "failureModeSummary": "Complexity is over-interpreted, valuation assumptions remain implicit, and conclusions cannot be traced to underlying events.",
      "scopeNonClaimsSummary": "This entry is scoped to regulated banking environments in the EU/UK and operational interpretation for DeFi exposure and yield assessment.",
      "source": {
        "contentPath": "content/analysis-models/defi-positions-yield-income-assessment-eu.mdx"
      },